{
  "schema_version": 1,
  "milestone": "M12",
  "status": "qualified",
  "start_sha": "c5ddf7c87cac46d357cfe75d132a819c7cf3fbe4",
  "qualified_implementation_sha": null,
  "child_commit": "21d9f3450276d42e5fedd1ddb9e80485b888cc07",
  "vaeg_commit": "7dd453cbd36014ba453a26765b00cd0cc9a99655",
  "route": "accepted M08 firmware read callback retained by resident kernel entry",
  "abi": {
    "entry": "pc88va_kernel_disk_read",
    "argument": "AX points to the exported resident M12 request record",
    "result": "AX typed status; RD_COMPLETED reports valid bytes",
    "ownership": "request and buffer are kernel-resident; destination is the declared resident buffer",
    "reentrancy": "prohibited"
  },
  "geometry": {"sector_bytes": 1024, "sectors_track": 8, "heads": 2, "total_sectors": 1280},
  "limits": {"max_request_bytes": 4096, "max_retries": 3, "zero_count": "rejected as range", "writes": "no write or format commands"},
  "boundaries": ["R0", "R1", "R2", "R3", "R4", "R5", "R6", "R7", "R8", "R9"],
  "excluded": ["disk_write", "format", "HDD", "media_change", "DOS_block_driver", "COMMAND.COM", "full_DOS", "hardware_validation"]
}
